{
  "$schema": "https://json-schema.org/draft/2020-12/schema",
  "$id": "https://github.com/derekluciani/pi-golf/blob/main/.pi/extensions/golf/course-loader/course.schema.json",
  "title": "Pi Golf Course version 1",
  "type": "object",
  "additionalProperties": false,
  "required": [
    "schemaVersion",
    "id",
    "name",
    "holes"
  ],
  "properties": {
    "schemaVersion": {
      "const": 1
    },
    "id": {
      "type": "string",
      "minLength": 1,
      "maxLength": 64,
      "pattern": "^[a-z0-9](?:[a-z0-9._-]{0,63})$"
    },
    "name": {
      "type": "string",
      "minLength": 1,
      "maxLength": 30,
      "pattern": "^(?!\\s)(?!.*\\s$)[^\\u0000-\\u001f\\u007f]{1,30}$"
    },
    "holes": {
      "type": "array",
      "minItems": 1,
      "maxItems": 18,
      "items": {
        "$ref": "#/$defs/hole"
      }
    }
  },
  "$defs": {
    "point": {
      "type": "object",
      "additionalProperties": false,
      "required": [
        "x",
        "y"
      ],
      "properties": {
        "x": {
          "type": "number",
          "minimum": -1000000,
          "maximum": 1000000
        },
        "y": {
          "type": "number",
          "minimum": -1000000,
          "maximum": 1000000
        }
      }
    },
    "polygon": {
      "type": "object",
      "additionalProperties": false,
      "required": [
        "type",
        "points"
      ],
      "properties": {
        "type": {
          "const": "polygon"
        },
        "points": {
          "type": "array",
          "minItems": 3,
          "items": {
            "$ref": "#/$defs/point"
          },
          "maxItems": 1024
        }
      }
    },
    "ellipse": {
      "type": "object",
      "additionalProperties": false,
      "required": [
        "type",
        "center",
        "radiusX",
        "radiusY"
      ],
      "properties": {
        "type": {
          "const": "ellipse"
        },
        "center": {
          "$ref": "#/$defs/point"
        },
        "radiusX": {
          "type": "number",
          "exclusiveMinimum": 0,
          "maximum": 1000000
        },
        "radiusY": {
          "type": "number",
          "exclusiveMinimum": 0,
          "maximum": 1000000
        }
      }
    },
    "corridor": {
      "type": "object",
      "additionalProperties": false,
      "required": [
        "type",
        "points",
        "width"
      ],
      "properties": {
        "type": {
          "const": "corridor"
        },
        "points": {
          "type": "array",
          "minItems": 2,
          "items": {
            "$ref": "#/$defs/point"
          },
          "maxItems": 1024
        },
        "width": {
          "type": "number",
          "exclusiveMinimum": 0,
          "maximum": 1000000
        }
      }
    },
    "region": {
      "type": "object",
      "additionalProperties": false,
      "required": [
        "terrain",
        "shape"
      ],
      "properties": {
        "terrain": {
          "enum": [
            "rough",
            "fairway",
            "green",
            "bunker",
            "water"
          ]
        },
        "shape": {
          "oneOf": [
            {
              "$ref": "#/$defs/polygon"
            },
            {
              "$ref": "#/$defs/ellipse"
            },
            {
              "$ref": "#/$defs/corridor"
            }
          ]
        }
      }
    },
    "hole": {
      "type": "object",
      "additionalProperties": false,
      "required": [
        "id",
        "number",
        "par",
        "boundary",
        "tee",
        "cup",
        "regions"
      ],
      "properties": {
        "id": {
          "type": "string",
          "minLength": 1,
          "maxLength": 64,
          "pattern": "^[a-z0-9](?:[a-z0-9._-]{0,63})$"
        },
        "number": {
          "type": "integer",
          "minimum": 1,
          "maximum": 18
        },
        "par": {
          "type": "integer",
          "minimum": 3,
          "maximum": 5
        },
        "boundary": {
          "$ref": "#/$defs/polygon"
        },
        "tee": {
          "$ref": "#/$defs/point"
        },
        "cup": {
          "$ref": "#/$defs/point"
        },
        "regions": {
          "type": "array",
          "items": {
            "$ref": "#/$defs/region"
          },
          "maxItems": 128
        }
      }
    }
  }
}
